"Senior Data Scientist, eComm (Machine Learning Algorithms, Data Analysis, & Big Data experience)",Walmart,"Position Summary...
What you'll do...
Data Strategy: Understands, articulates, and applies principles of the defined strategy to routine business problems that involve a single function.
Data Source Identification: Supports the understanding of the priority order of requirements and service level agreements. Helps identify the most suitable source for data that is fit for purpose. Performs initial data quality checks on extracted data.
Analytical Modeling: Selects the analytical modeling technique most suitable for the structured, complex data and develops custom analytical models.
Conducts exploratory data analysis activities (for example, basic statistical analysis, hypothesis testing, statistical inferences) on available data.
Defines and finalizes features based on model responses and introduces new or revised features to enhance the analysis and outcomes. Identifies the dimensions of the experiment, finalizes the design, tests hypotheses, and conducts the experiment. Perform trend and cluster analysis on data to answer practical business problems and provide recommendations and key insights to the business. Mentors and guides junior associates on basic modeling and analytics techniques to solve complex problems.
Model Assessment & Validation: Identifies the model evaluation metrics. Applies best practice techniques for model testing and tuning to assess accuracy, fit, validity, and robustness for multi-stage models and model ensembles.
Model Deployment & Scaling: Supports efforts to ensure that analytical models and techniques used can be deployed into production. Supports evaluation of the analytical model. Supports the scalability and sustainability of analytical models.
Code Development & Testing: Writes code to develop the required solution and application features by using the recommended programming language and leveraging business, technical, and data requirements. Test the code using the recommended testing approach.
Data Visualization: Generates appropriate graphical representations of data and model outcomes. Understands customer requirements to design appropriate data representation for multiple data sets. Work with User Experience designers and User Interface engineers as required to build front end applications. Presents to and influences the team and business audience using the appropriate frameworks and conveys clear messages through business and stakeholder understanding. Customize communication style based on stakeholder under guidance, and leverages rational arguments.
Guide and mentor junior associates on story types, structures, and techniques based on context.
Problem Formulation: Translates business problems within one's discipline to data related or mathematical solutions. Identifies what methods (for example, analytics, big data analytics, automation) would provide a solution for the problem. Shares use cases and gives examples to demonstrate how the method would solve the business problem.
Applied Business Acumen: Provides recommendations to business stakeholders to solve complex business issues. Develops business cases for projects with a projected return on investment or cost savings. Translates business requirements into projects, activities, and tasks and aligns to overall business strategy. Serves as an interpreter and conduit to connect business needs with tangible solutions and results. Recommends new processes and ways of working.
Demonstrates up-to-date expertise and applies this to the development, execution, and improvement of action plans by providing expert advice and guidance to others in the application of information and best practices; supporting and aligning efforts to meet customer and business needs; and building commitment for perspectives and rationales.
Provides and supports the implementation of business solutions by building relationships and partnerships with key stakeholders; identifying business needs; determining and carrying out necessary processes and practices; monitoring progress and results; recognizing and capitalizing on improvement opportunities; and adapting to competing demands, organizational changes, and new responsibilities.
Models compliance with company policies and procedures and supports company mission, values, and standards of ethics and integrity by incorporating these into the development and implementation of business plans; using the Open Door Policy; and demonstrating and assisting others with how to apply these in executing business processes and practices.
Our Ideal Candidate WIll Have:
Experience with Java, Python, Pyspark, Tensorflow ,PyTorch or other related big data and machine learning technologies to design and develop robust high-performance and scalable applications
Knowledge of data analysis methods and techniques (e.g., Dimensionality reduction, predictive modelling, clustering, text mining etc.) for feature engineering.
Experience developing models with structured and unstructured data sets using advanced machine learning algorithms (Neural Networks, Regression Models, Gradient Boosting Algorithms).
About Global Tech
Imagine working in an environment where one line of code can make life easier for hundreds of millions of people and put a smile on their face. That’s what we do at Walmart Global Tech. We’re a team of 15,000+ software engineers, data scientists and service professionals within Walmart, the world’s largest retailer, delivering innovations that improve how our customers shop and empower our 2.2 million associates. To others, innovation looks like an app, service or some code, but Walmart has always been about people. People are why we innovate, and people power our innovations. Being human-led is our true disruption.

We’re virtual
Working virtually this year has helped us make quicker decisions, remove location barriers across our global team, be more flexible in our personal lives and spend less time commuting. Today, we are reimagining the tech workplace of the future by making a permanent transition to virtual work for most of our team. Of course, being together in person is an important part of our culture and shared success. We’ll collaborate in person at a regular cadence and with purpose.
Minimum Qualifications...
Outlined below are the required minimum qualifications for this position. If none are listed, there are no minimum qualifications.
Option 1- Bachelor’s degree in Statistics, Economics, Analytics, Mathematics, Computer Science, Information Technology, or related field and 3
years' experience in an analytics related field. Option 2- Master’s degree in Statistics, Economics, Analytics, Mathematics, Computer Science,
Information Technology, or related field and 1 years' experience in an analytics related field. Option 3 - 5 years' experience in an analytics or
related field.
Preferred Qualifications...
Outlined below are the optional preferred qualifications for this position. If none are listed, there are no preferred qualifications.
Data science, machine learning, optimization models, Master’s degree in Machine Learning, Computer Science, Information Technology, Operations Research, Statistics, Applied Mathematics, Econometrics, Successful completion of one or more assessments in Python, Spark, Scala, or R, Using open source frameworks (for example, scikit learn, tensorflow, torch)"
"Machine Learning Manager (Network), Cash App",Cash App,"Company Description

Cash App is the fastest growing financial brand in the world. Built to take the pain out of peer-to-peer payments, Cash App has gone from a simple product with a single purpose to a dynamic money app with over 30 million active monthly users.
Loved by customers and by pop culture, we’ve held the #1 spot in finance on the App Store for almost two years, and our social media posts see more engagement in a day than most financial brands see in a year.
With major offices in San Francisco, New York, St. Louis, Portland, Kitchener-Waterloo, Toronto and Melbourne, Cash App is bringing a better way to send, spend, and save to anyone who has ever sought an alternative to today’s banking system.

Job Description

We're looking for a Manager to join our Network Machine Learning team and help build Cash App, the fastest growing financial app in the world. Our mission is to make banking and financial services accessible to the underserved and unbanked and directly transform people's relationship with their money. The Network ML team at Cash uses our large and unique datasets to model, understand, and predict customer behavior to help design and improve our core peer-to-peer product features. You'll report directly to the Head of Data Science and Machine Learning and you will partner with our Network Product team to create projects and provide value to our customers through the use of applied machine learning.
You will:
Recruit, lead, and mentor a team (currently a team of 1, with future growth planned)
Collaborate directly with members of your team, provide coaching that ensures their success, provide hands-on technical guidance and direction
Work on and lead multiple ML projects such as customer search, recommendations, link prediction, network virality, and more
Partner and collaborate closely with Cash App's product and business leaders as well as work with Product, Platform, and Data Engineering teams to prioritize efforts that will bring your team's work to life
Identify new opportunities, develop prototypes and advocate for staffing needs
Highlight your team's work with senior leadership and the executive team and help shape Cash App's ML and Network product strategies
Stay up-to-date with the latest trends and techniques in ML and foster a culture of learning across the team

Qualifications

You have:
5+ years of software engineering, machine learning/data science experience including hands-on management
Deep knowledge of and experience with a range of machine learning algorithms/techniques and expertise in applying machine learning in a production setting
Software engineering fundamentals and the ability to write production code when needed
Well-developed statistical and mathematical skills and experience with concepts such as causality, selection bias, incrementality, hypothesis testing and more
Experience working effectively with a Product team
A passion for delivering on Cash App's vision of economic empowerment
Technologies we use and teach:
Python (and its data analysis and machine learning libraries/frameworks)
Java or Scala
SQL (Snowflake), Airflow and Tableau
Additional Information

Cash App treats all employees and job applicants equally. Every decision is based on merit, qualifications, and talent. We do not discriminate on the basis of race, religion, color, national origin, gender, sexual orientation, age, marital status, veteran status, or disability status. We will consider for employment qualified applicants with criminal histories in a manner consistent with each office’s corresponding state and city guidelines."
"AI/ML - Software Engineer, ADPT",Apple,"Summary
Posted: Nov 12, 2020
Role Number:200207147
The Adaptive Devices and Personalization Technologies (ADPT) team within AIML is looking for an exceptional software engineer who is passionate about developing, driving and deploying innovative platforms, technologies and features to millions of Apple users. As part of an elite team, you will work across the full stack in the Apple ecosystem on next generation products and incubations. We are looking for ambitious, strongly technical and creative team players. Candidates should be adept at driving clarity through uncertainty, taking calculated risks, and failing fast.
Key Qualifications
Excellent algorithm and data structure skills (time and space complexity analysis, optimization, etc)
Expertise in Objective C, C/C++ at both the systems level and application level
Expertise in building libraries, frameworks, and command-line tools and/or web services and protocols
Excellent interpersonal and collaboration skills
Description
If hired, you will work with a passionate, product-focused team focused on delivering commitments on time with the highest level of quality. To succeed, you must be a proactive and determined problem solver with proven ability to work across multiple code bases, teams and organizations. You must enjoy writing elegant code and applying innovative new methods to create value for your products. This position offers the right person a chance to play an important role in the next revolution in machine learning. You will contribute to platforms, technologies and features that promise to change users' lives. You will be part of a team that’s infusing machine learning into more and more Apple products, and helping to define new product opportunities for the company.
Education & Experience
M.S. or Ph.D. in Computer Science, Electrical Engineering, Statistics, Physics or related field.
Additional Requirements
5+ years of experience developing shipping commercial software
5+ years working on systems level problems (OS, distributed, mobile, embedded)
Good Practical Experience With Swift And/Or Objective C
Demonstrated ability to quickly learn and modify large, existing code bases
Skill In Efficiently Implementing Algorithms Published In Technical Papers
Enthusiasm for learning and applying machine learning
Knowledge of Apple’s development APIs (i.e. Core ML, etc) and design principles"
Machine Learning Engineer,Robby Technologies,"Job Responsibility
Use deep learning or classical machine learning to do object detection, recognition or other related tasks.
Job Requirements
Fluency in C++
Experience in deep learning or classical machine learning for object detection or related tasks
Experience in using Torch, TensorFlow, or equivalent neural network platforms"
Statistician,National Older Worker Career Center,"Statistician

ID: NASS-WFO-001 Location: Sacramento Program: NASS


Wage/Hr: $54.00 Hours/Week: 24 Minimum Age: 55

Qualifications:

MA/MS Degree in Statistics
Experience required with Windows, MS Word, MS Excel
Duties:

This position is responsible for designing, developing, and maintaining data analysis and estimation tools and providing methodological support to commodity statisticians in the Agency.
Update objective measurement linear models using SAS Proc IML 20%
Design and select samples for objective measurement surveys and fruit/nut acreage surveys. 25%
Update and run computer programs to transfer and summarize County Agricultural Commissioner Reports. 10%
Update computer programs used to support the CA EDD\NASS Agricultural Labor External Project Agreement 10%
Update computer programs and train staff on processing crop Objective Measure Survey, County Agricultural Commissioner Reports, and Labor surveys 35%"
Product Manager - Machine Learning and Data Platform,Niantic,"Do you want to use data to design products and make decisions at scale, delighting users today and helping craft the future of real-world gaming and Augmented Reality? Join Niantic, the developer of Pokémon GO and Harry Potter: Wizards Unite, as a Product Manager on the Data Platform team to lead, innovate, and build outstanding experiences across our suite of products and games. Partner with scientists, engineers, and product managers to develop products and processes to power a data-informed culture and ecosystem on the Niantic Real World Platform for millions of people around the world, every day.

Responsibilities
Collaborate with cross-functional partners to conceptualize, prototype, iterate, then land new products and features across our platform and games.
Initiate and lead multiple concurrent 0 to 1 product development efforts, working closely with engineering, marketing, legal, design, and business development teams.
Identify user and business needs then work with teams to develop strategic and scalable solutions across all-things-data at Niantic.
Employ Machine Learning and Data Science to personalize and optimize experiences for our users.
Develop products and processes that foster and enable a data-informed product design and decision making practice.
Define, track and grade OKRs (objectives and key results).
Communicate product status, key issues, and launch plans to decision-makers across the organization.
Qualifications
You have 5+ years product management or other experience working with data.
You have a BA/BS in computer science, engineering, math, business administration or relevant knowledge.
You are highly collaborative and passionate about using behavioral data to improve user experience and product performance; able to inspire and educate designers and engineers with thought-provoking objectives and customer-centric use cases.
You possess an entrepreneurial spirit — taking initiative and self-starter, as part of a team.
You use quantitative, experimentation-based problem-solving skills, such as A/B testing, to make product improvements
Your collaboration skills and relationship management is strong to effectively work across many leading-edge technology areas and cross-functional teams.
You achieve results-oriented goals in a fast-paced, ambiguous, and constantly evolving environment, demonstrating excellent business judgment.
Your communication skills are excellent with the ability to understand technical subjects and emerging technologies and their relevance to the marketplace.
Plus If...
You have developed and deployed machine learning models or data-powered products.
You have experience with large scale data processing (e.g. BigQuery, Spark, Hive, DataFlow/Beam) or programming languages (e.g. Python, Java, Scala, Go).
You are skilled in statistics and the science underlying data-informed techniques.
You have worked in omnichannel, direct marketing, or performance marketing applications.
You are familiar with the gaming industry, especially Niantic's games.
Join the Niantic team!

Niantic is the world's leading AR technology company, sparking creative and engaging journeys in the real world. Our products inspire outdoor exploration, exercise, and meaningful social interaction.

Originally formed at Google in 2011, we became an independent company in 2015 with a strong group of investors including Nintendo, The Pokémon Company, and Alsop Louie Partners. Our current titles include pioneering global-control game Ingress, record-breaking AR game Pokémon GO, and recently released third title, Harry Potter: Wizards Unite.

Niantic is an Equal Opportunity employer. We believe that cultivating a workplace where our people are supported and included is essential to creating great products our community will love. Our mission emphasizes seeking and hiring diverse voices, including those who are traditionally underrepresented in the technology industry, and we consider this to be one of the most important values we hold close.

We're a hard-working, fun, and exciting group who value intellectual curiosity and a passion for problem-solving! We have growing offices located in San Francisco, Sunnyvale, Bellevue, Los Angeles, London, Tokyo, Hamburg, and Zurich."
Senior Product Data Analyst,Waymo,"Waymo is a self-driving technology company with a mission to make it safe and easy for people and things to get where they’re going. Since our start as the Google Self-Driving Car Project in 2009, Waymo has been focused on building the World’s Most Experienced Driver in hopes of improving the world's access to mobility while saving thousands of lives now lost to traffic crashes. Our Waymo Driver powers Waymo One, our autonomous ride-hailing service, as well as Waymo Via, our trucking and local delivery service. To date, Waymo has driven over 20 million miles autonomously on public roads across 25 U.S. cities and conducted over 15 billion miles of simulation testing.

Waymo takes an integrated approach to building the world’s first self-driving car, with researchers, designers, product managers, and technical program managers working side by side. We seek to understand the needs of our users and the opportunities of the technology to ensure we build the best product. From self driving behavior to user interfaces, we work to inspire the product vision and then make it a reality.

In this role you’ll:

Analyze data to create a deeper understanding of the Waymo Driver and its behaviors
Define key metrics to track the performance of the driving system to accelerate improvements
Present findings to key leadership to influence product roadmaps
Analyze simulation, experimentation, and log data to provide actionable insights
Own a domain and work with engineers, product managers, and program managers to make that area a success

At a minimum we’d like you to have:

Demonstrated ability to extract actionable insights from data

Expertise using Python or R to perform detailed statistical analysis and modeling
Expertise using SQL to extract, clean, and transform data in large, complex, nested, databases
The ability to create intuitive and readable dashboards using visualization tools (e.g. Tableau, Plotly, Data Studio)
Excellent written and verbal communication skills
Demonstrated strong intellectual curiosity
It’s preferred if you have:

The deep conviction that correlation does not assure causation
Experience with geospatial statistical analysis
Experience with the transportation sector

Experience with autonomous vehicles
An advanced degree in Statistics, Economics, Mathematics, Computer Science or similar field"
AI DEVELOPER,Acuitus,"We are leveraging the state-of-the-art in Artificial Intelligence along several critical dimensions. Our psychological modeling, for capturing the behaviors of students, our modeling of human memory, the epistemology of content, and the behavior of tutors is unrivaled. We are looking to hire an AI Developer to continue to develop two-dimensional handwriting recognition, our human-tutor interface, as well as the modeling of deep psychological processes.
Requirements
Track record of developing world-class AI applications
Solid understanding of core machine learning principals or a specific area of focus
Excellent interpersonal and communication skills
Passion for excellence and innovation"
