Machine Learning Engineer,Belcan,"A Machine Learning Engineer is needed for a position in Mountain View, California through Belcan. We are seeking passionate candidates for a machine learning/ deep learning software engineering role who will join as a machine learning research engineer helping the team build and demo innovative ML/DL applications. To qualify for this role, you will have a Bachelor's Degree in Computer Science/Electrical Engineering, Math, or related field. Bachelors with at least 3-4 years of experience; Masters with at least 1-2 years of experience; Strong software engineering practices in Python with machine learning experience in a production setting.
This is a 4 month assignment.

Machine Learning Engineer

Description
Autonomous vehicles, deep learning / artificial intelligence, edge computing, IoT are some of the trending buzz words in the automotive industry. Connected cars, which can be a combination of all of the above and much more, are a path breaking space with a lot of potential for new customer centric mobility and safety applications. Intelligent Mobility Systems (IMS) group , is conducting research in connected and automated car technologies to build the future mobility system which includes the development of simulation platform, distributed and hierarchical machine learning system, developing and testing prototype connected and automated vehicle applications. We are seeking passionate candidates for a machine learning/ deep learning software engineering role who will join as a machine learning research engineer helping the team build and demo innovative ML/DL applications:

Responsibilities
As a Machine Learning Engineer, you will contribute to state-of-the-art machine learning infrastructure and relevant software (e.g. supervised learning, reinforcement learning, data management, and evaluation at unparalleled scale). You will implement cutting-edge deep learning models accelerating model training performance for intelligent mobility system applications and tackling open problems together with researchers. Last but not least, you will deploy your algorithms and models in our test vehicles platform. Responsibilities and required qualifications are as follows:

Implement machine learning/ deep learning models (supervised learning, reinforcement learning) for the following tasks: 2D/3D object detection, semantic segmentation, depth estimation, traffic (time or speed) prediction and driving behavioral learning etc.
Address large scale challenges in the machine learning development cycle, especially around distributed training and inferencing environment in the cloud and data engineering.
Manipulate high-volume, high-dimensionality, structured data from driving logs for training and testing deep networks.
Produce high quality tested code that enables large scale research and can be transferred to physical vehicles deployed in the real world.
Stay up to date on the state-of-the-art in Deep Learning ideas and software, in collaboration with our Researchers.
Coding, proof-of-concept (POC) and demo deep learning applications with our test vehicle platform.
Work in a multidisciplinary team and collaborate with other teams across the research lab.

Requirements:
Qualifications

Bachelor's Degree in Computer Science/Electrical Engineering, Math, or related field.

Bachelors with at least 3-4 years of experience; Masters with at least 1-2 years of experience; Strong software engineering practices in Python with machine learning experience in a production setting.

Strong Machine Learning background with deep understanding of different types of machine learning algorithms (e.g., CNN, RNN, LSTM and Reinforcement Learning). Experience of training deep-learning models in an end-to-end fashion.

Project experience working with Pytorch, Tensorflow or other modern deep learning frameworks.

Computer Vision expertise not required - but recommended.

Proficient in Python and Unix is a minimum. Additional knowledge of C++ / CUDA is a plus, experience with AWS as well.

Clear grasp on basic Linear Algebra, Optimization, Statistics, and Algorithms.

Familiar with Python development co-system including numpy, scipy, pandas, sklearn etc and comfortable with development in Linux

Excellent verbal and written communication skills

(Optional) Real-time traffic and autonomous vehicle simulation experience with e.g. Unity, CARLA etc.

(Optimal) Implemented state-of-the-art models from research papers (share paper/repos if you can).

(Optimal) Experience with Deep Reinforcement Learning, Multi-agent distributed reinforcement learning

(Optional) Experience with computer vision and large-scale distributed training.

(Optimal) Publication in robotics/ML/CV conference
If you are interested in the Machine Learning Engineer job opportunity, please apply via the apply now link provided. Belcan is a leading provider of qualified personnel to many of the world's most respected enterprises. We offer excellent opportunities for contract/temporary, temp-to-hire, and direct assignments in the engineering, IT and professional fields. We are the employer of choice for thousands worldwide. Belcan is a team-driven Equal Opportunity Employer committed to workforce diversity. For more information, please visit our website at http://www.belcan.com."
"Senior Business Intelligence (BI) Data Scientist, Small Business Lending",OPPORTUNITY FUND NORTHERN CALIFORNIA,"Description:

The Organization:
In March 2020, Opportunity Fund, the country’s leading nonprofit small business lender, and the Accion U.S. Network, the U.S. affiliate of global nonprofit Accion that has led a nationwide network of community lenders since 2011, combined efforts to form Accion Opportunity Fund/Opportunity Fund.
The nation’s 30 million small business owners often lack access to affordable credit from responsible lenders offering attractive loans and services. Industry estimates suggest that there is an $87 billion annual market gap in loans less than $100,000 for Main Street entrepreneurs. Addressing this gap can ensure that small business owners can sustain their enterprises; drive job creation; and stimulate regional economies through increased wages, spending and tax revenue.
Leveraging the strengths of both organizations, Accion Opportunity Fund will spearhead the development of a national microlending strategy to meet the credit needs of small businesses – developing new products, establishing new partnerships, promoting research and financial education, and leveraging digital technologies and data analytics to support mission-driven lending.
Opportunity Fund remains as an independent Community Development Financial Institution (CDFI) focused on expanding its lending and advisory services in California and other markets in the US. Our mission to drive economic mobility by delivering affordable capital and responsible financial solutions to determined entrepreneurs and communities.
The Role:
Reporting to the Senior Director, Analytics and Business Intelligence, we are looking for a talented, enthusiastic, and results-driven Senior Business Intelligence (BI) Data Scientist to join our growing team of analytics experts. The hire will be responsible for managing business intelligence reporting facilities and the creation of dashboards, visualizations and the analysis of those reports in support of the organization’s lending decisioning across all aspects of Marketing, Sales, Product, Credit and Operations. In order to be successful, this will also require building data and analytics infrastructure, developing innovative ways to bring external and internal data together and advancing data extraction and transformation related IPs. The ideal candidate should be experienced in data conceptualization, data management, and data reporting, with advanced machine learning experience a plus. The candidate is an avid and quick learner of new concepts, skills and technologies, with strong ability to productionalize analytic solutions.
Opportunity Fund has an analytics environment that encourages openness of discussion, knowledge exchange, constant learning and pursuit of intellectual curiosity. We encourage analytics development based on deep understanding of the intricacies of the evolving customer segments, loan product lines and their life cycle, and build advanced analytics solutions that drive business decisions, actions and results.
Key Responsibilities/Accountabilities:
Build data analytics infrastructures. Define data, map data, and develop/manage data warehouse solutions.
Set up and manage reporting tools to ensure efficiency, effectiveness and continuous improvement.
Deliver actionable data analytics insights and reporting through publishing tools such as Tableau, SSRS (or Power BI)
Prepare data files following specific requirements and manage the sending/receiving of data to/from external data or business partners.
Serve as the data coordinator for data requests from internal business partners. Conduct data preparation and analyses.
Develop the business requirements needed and work with Data Engineering to build the infrastructure required for optimal extraction, transformation, and loading of data from a wide variety of data sources using SQL and AWS technologies.
Work with stakeholders including the Executive, Product, Data and Analytics teams and the leaders within the Small Business team to resolve data-related issues, requests and requirements.
Work with database management, data engineering and business partners to strive for greater functionality in our data systems and governance.
Serve as an expert consultant to senior management on highly complex data issues.
Learn and understand the business in detail and educate the organization in the use and understanding of data.
Perform other analytics, machine learning or data mining duties using basic to more advanced approaches. Handle complex solutions delivery initiatives.
. Requirements:

The Person:
Highly qualified candidates will share Opportunity Fund’s commitment to its mission and will embody the organization’s core values bringing a broad range of skills and experience including, but not limited to:

5+ years of experience in data extraction, transformation and reporting with strong analytical, conceptual and quantitative problem-solving skills.
Bachelors, Master or Ph.D. Degree, preferably in a quantitative area such as Mathematics, Statistics, Computer Science, Information Systems, Engineering, or Economics a plus. A combination of education and experience may be considered.
Keen interest in data value discovery, data management, infrastructure development, and data related technology advancement.
Good working SQL knowledge and experience working with relational databases, query authoring (SQL) as well as working familiarity with a variety of databases. Proficiency in at least one of the following: Python, SAS, or R.
Good working knowledge with Tableau and/or SSRS or similar business intelligence tools. Experience with data pipeline and workflow management tools, including SSIS or CDATA.
A successful history of manipulating, processing and extracting value from large disconnected datasets.
Experience with source and target data management, data governance, data security, data quality and related tools desired.
Knowledge of the lending business with knowledge of small business lending a plus.
Excellent communication and influencing skills.
Ability to manage multiple concurrent and competing priorities.
Ability to identify key issues, resolving and communicating the issues cross-functionally.
Perks & Benefits:
Our mission is what motivates us to come to work each day. We know that happy employees are productive employees, which is why we offer a comprehensive benefits package that includes:Competitive salary commensurate with experience.An environment that values work-life balance.100% company-funded Medical, Dental, Vision, Life & Disability coverage for employees. Family coverage is also available.Tax deferred & Roth 403(B) Retirement Plan with employer match. Employer match increases with tenure.Paid vacation (increased with tenure), 13 paid holidays, sick, and family leave days.This position is located in the San Francisco Bay Area. Currently, due to COVID-19 this position is fully REMOTE.
Diverse candidates are encouraged to apply.
 Opportunity Fund is an Equal Opportunity Employer. www.opportunityfund.org"
Omnicept AI Research Engineer,HP Inc.,"HP Labs is an international research organization headquartered in Palo Alto, CA. HP Labs' purpose is to deliver breakthrough technologies and technology advances that provide a competitive advantage by investing in fundamental science and technology in areas of interest to HP.


The Omnicept AI (http://hp.com/omnicept) team within HP Labs is spearheading the application of artificial intelligence to physiological signals from VR headsets to make inferences about the human mind. In our lab, we conduct research to gain fundamental understanding of AI algorithms and apply these algorithms to HP data for practical business impact.


Some of our research topics include:


(1) Affective computing and Cognitive Science


(2) Virtual Reality and Digital Twins to model complex processes.


(3) Deep Learning techniques


(4) Real-time control of cyber-physical systems,


(5) Computer vision,


If you have strong technical skills, are intensely curious, and like to attack the hardest and most challenging problems, want to make a difference in the lives of others and want to work in a highly collaborative and supportive environment, then we invite you to apply to join our team.


In this role, you will:
Use machine learning to develop a better understanding of the human condition, allowing for more adaptive and personalized experiences.
Design, implement and evaluate models, and build software prototypes of machine learning systems with broad impact.
Work in a cross-functional team environment to realize your research aspirations.
Qualifications:


Minimum:
Masters degree in Computer Science with specialization in Artificial Intelligence, Machine Learning, Robotics, Computational Neuroscience, or related technical field with a strong publication or practical implementation.
Strong deep learning experience, particularly in application of Neural Network architectures to Physiological Sensing, Cognitive Science, Computer Vision, Machine Intelligence and/or Reinforcement Learning.
Strong understanding of data management along with model evaluation and training techniques for Neural Networks.
Experience in one or more deep learning frameworks such as Tensorflow, Pytorch, Torch, or Caffe.
Publications in highly ranked ML and AI conferences and/or journal publications.
Strong verbal, written and presentation skills.
One or more programming languages: Python, C++/C, Java, MATLAB
Enjoy working in a highly collaborative environment
Preferred:
Ph.D. degree in Artificial Intelligence, Machine Learning, Robotics, Computational Neuroscience, or related technical field with a strong publication or practical implementation.
Research focus on one of the following: Recurrent Neural Networks, Attention Modeling, Machine Reasoning, Data Augmentation, Model Interpretability, or Generative Adversarial Networks.
International reputation in Deep Learning as evidenced by publication record, invited presentations, blogs, etc.
Strong understanding of data science and classical ML techniques.
Contributions to open source projects.
Experience with Unity or Unreal 3D engines.
Experience deploying machine learning models in production environments at the edge
Experience or interest in monitoring or controlling physical systems using Machine Learning.
Computational Neuroscience modeling experiences.
Interest at the intersection of computer vision and language."
Data Scientist I,System One,"Job Title: Data Scientist I
Contract Length: 6 months, renewable
Job Description:
Data Scientist I (DS) is responsible for supporting the execution of data analysis to help demonstrate clinical and health economics value of diagnostics using electronic medical records, insurance claims and disease/patient registry data. The data scientist generates quantitative evidence on disease diagnosis, treatment, and outcomes from these various data sources in partnership with the Data Science and Services (DSS) team to strengthen and support life cycle product positioning and also in support of software teams to demonstrate the value of Clinical Decision Support (CDS) products. The candidate will work closely with the DSS team to link healthcare databases using standard algorithms and data dictionaries. He/she maintains and expands knowledge of available data sources and applicable analysis methodologies and tools. This is a great opportunity to apply your existing knowledge and gain additional state-of-the-art experience.
Skills:
Executes Real World Data (RWD) analytics solutions to support in successful development and commercialization and market access of diagnostics products and software
 Maintains and expands knowledge of available data sources and its application to the needs of life cycle teams, medical & scientific affairs, biomarker discovery, and market access groups
 Appreciates the needs of various stakeholders and offers real-world data analysis to suit their requirements
 Performs high quality, timely analyses using appropriate methodologies, tools and best practices
 Builds and maintains partnerships with other Data Scientists, Quantitative Scientists and key stakeholders
 Responsible for delivery on assigned projects
 Proactively raises ideas and identify opportunities to enhance ways of working (including processes, methods, technology etc.) and shares best practices and lessons learned with peers
Education:
Master’s in Data Science related discipline (Data science, computer science, statistics)
 Solid programming experience with R, Python, or SAS and/or other statistical software packages;
 Experience in using machine learning and big data analysis methods and platforms
 Experience working with healthcare data sets
In-depth Knowledge of relational database principles and corresponding basic query language skills (e.g. SQL)
 Strong problem solving skills and attention to detail. Data driven problem solving.
 Good knowledge of English in a business environment"
Sr. Statistical Programmer,Tekruiting,"Type: contract, w2 onlyDuration: 12+ monthsUnfortunately, no visa sponsorship is provided*Summary:Statistical Programmer will be responsible for supporting statistical programming activities for registrational and non-registrational studies. Participates as part of a study team and contributes towards developing, validating, and documenting programs written using SAS or other statistical analysis software to meet the study needs. In this role, Programmer will be accountable for the implementation and delivery of complete and accurate data and reports to support regulatory submissions. Organizes and facilitates programming tasks to ensure timely study deliverables.Skills:Must have knowledge of Base SAS, SAS/STAT, SAS macros, and SAS/GRAPH.Familiarity with statistical software, statistical analyses, and databases.Statistical programming, Data ManipulationClinical Trials, medical devicesStrong verbal and written communication skills.Education:Minimum required:  Bachelor’s degree in a scientific discipline.Preferred: Master’s degree in a scientific discipline.*Job Type: ContractSchedule:Monday to FridayEducation:Master's (Preferred)Experience:Statistical programming, Data Manipulation: 1 year (Preferred)Base SAS, SAS/STAT, SAS macros, and SAS/GRAPH: 1 year (Preferred)Clinical Trials, medical devices: 1 year (Preferred)Work Remotely:No"
JP00000775-IT - Data Scientist,The Norland Group,"We are seeking an experienced Data Scientist in the Digital Catalyst Team who will provide strong execution and delivery of data science. Working as a part of the product team, this Data Scientist will translate business needs into advanced analytics and machine learning models. The successful candidate will be responsible for model selection and identification of appropriate training data sets; building, training, and evaluating models; and delivering results to the business on a regular cadence. This role is part of a fully Agile Scrum team, so the data scientist will work alongside a product owner, technical lead, and team of developers and data engineers to support delivery of high-value analytics and software products.

Position Responsibilities:
� Leads development of high complexity models and training sets
� Provides hands-on execution and implementation of data science models
� Translates business analysis needs into well-defined data science problems, and selecting appropriate models and algorithms and communicates model evaluation and implications of results back to stakeholders
� Recognizes and prioritizes the most important work related to data science models to achieve highest operational impact for analytics in the business
� Balances tradeoffs among analytics value, model development methods and design and technologies used to implement data science models with a bias toward action
� Performs collaborative work on data science problems and mentor junior data scientists
� Creates shared process models, business objects, activity diagrams and process documentation to effectively articulate multiple views of the business solutions that support technical architecture.
� Manages development of quantitative models and tools.
� Collaborates with leaders, other LOBs, and business partners to work on issues, projects or activities.
� Develops new or revises complex models to predict business demand trends, and volume and expenditures forecasts capacity analysis, and various other metrics to identify potential opportunities.
� Assesses business implications associated with modeling assumptions, inputs, methodologies, technical implementation, analytic procedures and processes, and advanced data analysis.
� Partners with leaders to drive high performance in their lines of business.
� Develop deep understanding of business drivers and financial levers to provide strategic decision support.
� Oversees resolution of complex projects and programs.
� Develops and maintains up-to-date detailed project schedules and work plans.
� Performs analysis on complex data models requiring customized reports and data and presents recommendations. Bachelor's Degree in Econometrics, Economics, Engineering, Mathematics, Applied Sciences, Statistics or job-related discipline or equivalent experience
Job-related experience, 8 years, OR Masters Degree and job-related experience, 6 years, OR Doctorate Degree and job-related experience, 3 years. Experience in data modeling, 5yrs

Desired Education / Skills:
PhD in engineering or a related field (computer science, natural sciences, mathematics)
Experience with Python, R, Scala, SQL
Experience developing solutions with Pandas/Scikit-learn, Spark or comparable technologies
Experience data science notebooks (Jupyter, Zeppelin or other)
Experience with AWS, Azure, cloud computing technologies
Scrum team experience
Energy industry experience
Experience designing efficient data science workflows and database architecture for data science purposes
Experience with forecasting, Bayesian networks, and graph analytics
Strong statistics experience
Experience with software development methodologies and software engineering principles
Knowledge of program management theories, concepts, methods, best practices, and techniques as needed to perform at the job level
Knowledge of relevant programming languages - for example Visual Basic, Ladder Logic,
Programmable Logic Controller, C, SharePoint, HTML, Java, Adobe - as needed to perform at the job level
Competency in knowing the most effective and efficient processes to get things done, with a focus on continuous improvement
Knowledge of principles, techniques, and procedures used for production and design of technology based equipment and systems as needed to perform at the job level
Knowledge of statistical theories, concepts, methods, best practices, and analyses as needed to perform at the job level
Ability to develop reports, models, and simulations as needed to perform at the job level
Competency in developing and delivering multi-mode communications that convey a clear understanding of the unique needs of different audiences
Knowledge of data model design philosophies and methodologies for data warehouse and OLTP systems


We encourage Minorities, Women, Protected Veterans and Disabled individuals to apply for all positions that they may be qualified for. We maintain a drug-free workplace and perform pre-employment substance abuse testing and background checks


If you are interested in this position, please submit your resume in a Word Document with the month and year that you have worked at each previous position to - anna@norlandgroup.com and copy: JP00000775-IT - Data Scientist to the email Subject Line.

Or click this email link and attach your resume in a MS Word Document format

Job Posted Date: 11/10/2020"
