"Senior Data Scientist, eComm",Walmart,"Position Summary...
What you'll do...
Data Strategy: Understands, articulates, and applies principles of the defined strategy to routine business problems that involve a single function.
Data Source Identification: Supports the understanding of the priority order of requirements and service level agreements. Helps identify the most suitable source for data that is fit for purpose. Performs initial data quality checks on extracted data.
Analytical Modeling: Selects the analytical modeling technique most suitable for the structured, complex data and develops custom analytical models.
Conducts exploratory data analysis activities (for example, basic statistical analysis, hypothesis testing, statistical inferences) on available data.
Defines and finalizes features based on model responses and introduces new or revised features to enhance the analysis and outcomes.
Identifies the dimensions of the experiment, finalizes the design, tests hypotheses, and conducts the experiment.
Perform trend and cluster analysis on data to answer practical business problems and provide recommendations and key insights to the business.
Mentors and guides junior associates on basic modeling and analytics techniques to solve complex problems.
Model Assessment & Validation: Identifies the model evaluation metrics. Applies best practice techniques for model testing and tuning to assess accuracy, fit, validity, and robustness for multi-stage models and model ensembles.
Model Deployment & Scaling: Supports efforts to ensure that analytical models and techniques used can be deployed into production. Supports evaluation of the analytical model. Supports the scalability and sustainability of analytical models.
Code Development & Testing: Writes code to develop the required solution and application features by using the recommended programming language and leveraging business, technical, and data requirements. Test the code using the recommended testing approach.
Data Visualization: Generates appropriate graphical representations of data and model outcomes. Understands customer requirements to design appropriate data representation for multiple data sets.
Work with User Experience designers and User Interface engineers as required to build front-end applications.
Presents to and influences the team and business audience using the appropriate frameworks and conveys clear messages through business and stakeholder understanding.
Customize communication style based on stakeholder under guidance, and leverages rational arguments.
Guide and mentor junior associates on story types, structures, and techniques based on context.
Problem Formulation: Translates business problems within one's discipline to data related or mathematical solutions. Identifies what methods (for example, analytics, big data analytics, automation) would provide a solution for the problem.
Shares use cases and gives examples to demonstrate how the method would solve the business problem.
Applied Business Acumen: Provides recommendations to business stakeholders to solve complex business issues.
Develops business cases for projects with a projected return on investment or cost savings.
Translates business requirements into projects, activities, and tasks and aligns to overall business strategy.
Serves as an interpreter and conduit to connect business needs with tangible solutions and results.
Recommends new processes and ways of working.
Demonstrates up-to-date expertise and applies this to the development, execution, and improvement of action plans by providing expert advice and guidance to others in the application of information and best practices; supporting and aligning efforts to meet customer and business needs; and building commitment for perspectives and rationales.
Provides and supports the implementation of business solutions by building relationships and partnerships with key stakeholders; identifying business needs; determining and carrying out necessary processes and practices; monitoring progress and results; recognizing and capitalizing on improvement opportunities; and adapting to competing demands, organizational changes, and new responsibilities.
Models compliance with company policies and procedures and supports company mission, values, and standards of ethics and integrity by incorporating these into the development and implementation of business plans; using the Open Door Policy; and demonstrating and assisting others with how to apply these in executing business processes and practices.
Preferred Qualifications:
Solid working knowledge in statistical programming language, SQL and data visualization
Master/Phd in statistics, business analytics, data science, or Information Systems highly preferred
Minimum Qualifications...
Outlined below are the required minimum qualifications for this position. If none are listed, there are no minimum qualifications.
Option 1- Bachelor’s degree in Statistics, Economics, Analytics, Mathematics, Computer Science, Information Technology, or related field and 3
years' experience in an analytics related field. Option 2- Master’s degree in Statistics, Economics, Analytics, Mathematics, Computer Science,
Information Technology, or related field and 1 years' experience in an analytics related field. Option 3 - 5 years' experience in an analytics or
related field.
Preferred Qualifications...
Outlined below are the optional preferred qualifications for this position. If none are listed, there are no preferred qualifications.
Data science, machine learning, optimization models, Master’s degree in Machine Learning, Computer Science, Information Technology, Operations Research, Statistics, Applied Mathematics, Econometrics, Successful completion of one or more assessments in Python, Spark, Scala, or R, Using open source frameworks (for example, scikit learn, tensorflow, torch)"
Senior Staff Software Engineer - Machine Learning Acceleration,Xilinx,"Description
We are looking for a self-driven and experienced C++ software engineer to be part of the Xilinx Vitis AI Software team. The Vitis AI Software team develops core software for deploying Machine Learning applications on Xilinx Deep Learning processors.
Being a member of the Vitis AI Software team requires passion and motivation to solve challenging and technical problems with robust algorithms and features. Our code is optimized for high throughput and low-latency – core requirements for Machine Learning inference.
You will be part of a global team that works on the end-to-end Xilinx Vitis AI software stack. Our software...
starts with user Machine Learning models from popular frameworks such as Tensorflow and TVM
compiles them to target various FPGA Deep Learning accelerators
deploys them for execution on FPGA devices

The flexibility of Xilinx FPGA allows many Deep Learning accelerator designs to be deployed on the same FPGA device. And since FPGAs are programmable, Vitis AI also allows users to optimize the user’s entire end-to-end system. The FPGA can deploy not only Deep Learning accelerators on Edge and in the Cloud – it can also be combined with other modules such as Vision or Post-processing – accelerating the user’s whole application on one chip.
Because of that, you will get a unique chance to work with possibly the largest portfolio of Deep Learning accelerator Hardware, Compiler and Software designs in the industry. It is also the most flexible portfolio of Deep Learning accelerators. Xilinx FPGA makes it easy to optimize each accelerator for a specific user application. It is also easy to experiment with state-of-the-art techniques (such as quantization or pruning).
As such, Vitis-AI software is not custom code tuned for one Machine Learning application. You will join us in our exciting effort to design and implement a simple, robust and general Software Stack to efficiently deploy all current and future FPGA accelerators.
As a Sr Staff Software Engineer, you will be a core member in our global team of RTL, Compiler, Software and Application Engineers. We work together from our offices in San Jose HQ, Beijing, and Hyderabad. Because of that, good communication and teamwork are essential. This listing is for a position in our San Jose headquarters.
In this team, members are involved in all aspects of Deep Learning accelerator development: design, prototyping, implementation, testing, and productization. The team is dynamic and offers each member personal opportunity to grow their knowledge and skills in complex problem solving, product development and software engineering.

Learn more about Xilinx and Vitis AI by visiting us at https://github.com/Xilinx/Vitis-AI

MSEE/MSCS with a minimum of 8 years of relevant work experience in software industry
Strong software development and debug skills
Must be able to demonstrate strong analytical and problem solving ability.
Must be able to excel in a team environment with good interpersonal and communication skills.
Fluency in C++, data structures, algorithms, parallel programming and operating systems
Experience with Machine Learning models and applications is preferred"
Machine Learning Intelligent Mobility System Engineer,"Artizen, Inc.","QUALIFICATIONS:Bachelor's Degree in Computer Science/Electrical Engineering, Math, or related field.Bachelors with at least 3-4 years of experience; Masters with at least 1-2 years of experience; Strong software engineering practices in Python with machine learning experience in a production setting.Strong Machine Learning background with deep understanding of different types of machine learning algorithms (e.g., CNN, RNN, LSTM and Reinforcement Learning). Experience of training deep-learning models in an end-to-end fashion.Project experience working with Pytorch, Tensorflow or other modern deep learning frameworks.Computer Vision expertise not required - but recommended.Proficient in Python and Unix is a minimum. Additional knowledge of C++ / CUDA is a plus, experience with AWS as well.Clear grasp on basic Linear Algebra, Optimization, Statistics, and Algorithms.Familiar with Python development co-system including numpy, scipy, pandas, sklearn etc and comfortable with development in LinuxExcellent verbal and written communication skills(Optional) Real-time traffic and autonomous vehicle simulation experience with e.g. Unity, CARLA etc.(Optimal) Implemented state-of-the-art models from research papers (share paper/repos if you can).(Optimal) Experience with Deep Reinforcement Learning, Multi-agent distributed reinforcement learning(Optional) Experience with computer vision and large-scale distributed training.(Optimal) Publication in robotics/ML/CV conferenceJob Type: ContractPay: $70.00 - $80.00 per hourSchedule:Monday to Friday"
Data Scientist,Triplebyte,"About Triplebyte

Triplebyte is transforming the way software engineers are hired. Our mission is to build an open, valuable and skills-based credential for all engineers and data scientists. This is important because millions of people have skills (and deserve good jobs), but don't fit the profile that recruiters seek. We aim to cut out that noise by matching opportunities to people who have the skills to succeed in them - regardless of their background.

Companies like Apple, Dropbox and American Express trust Triplebyte's technical assessment to identify the best engineers for their open roles and reduce the time and effort it takes to hire them.

We raised a $35 million Series B and our team of 64 is growing! We're building out the leadership of our team to help us scale to the next phase.

Press Links:

You can read more about our company and hear from our founders in the press here:

Triplebyte raises $35M for its online coding test and credentialing service for hiring engineers

Triplebyte incubates ColorStack to increase Black and Latinx representation in CS programs

CNBC (Your Next Job Interview Could be with a Robot)

Building an Engineering Team - Harj Taggar and Ammon Bartram

Role Description

As a data scientist at Triplebyte, you'll have the opportunity to work on a variety of challenges to help us scale. You'll be part of a small team, who are leveraging data to fix technical hiring. Your day to day, will include a mix of dataset acquisition, statistical modeling, exploratory data analysis, and software engineering. You'll report directly to Triplebytes' Head of Machine Learning and will work alongside a team of 6-8 machine learning engineers and data scientists.Fields your work will touch on
Psychometrics
Recommender systems
Time series analysis
Survival analysis
Bayesian inference
Probabilistic programming
This is an ideal role for a data scientist who wants the scope and responsibility to own features/products from the inception and research phase through to measuring real-world results.


Compensation and Benefits

Competitive salary and stock options package

Open vacation policy

Employer paid health, vision and dental insurance

401(k) plan with matching

Pre-tax commuter benefits

Daily catered lunches

The Company is an equal opportunity employer and makes employment decisions on the basis of merit and business needs. The Company does not discriminate against employees or applicants (in any aspect of employment, including, but not limited to recruiting and hiring, job assignment, compensation, opportunities for advancement, promotion, transfers, evaluation, benefits, training, discipline, and termination), on the basis of any characteristic protected under applicable federal, state, or local laws."
JP00000775-IT - Data Scientist,The Norland Group,"We are seeking an experienced Data Scientist in the Digital Catalyst Team who will provide strong execution and delivery of data science. Working as a part of the product team, this Data Scientist will translate business needs into advanced analytics and machine learning models. The successful candidate will be responsible for model selection and identification of appropriate training data sets; building, training, and evaluating models; and delivering results to the business on a regular cadence. This role is part of a fully Agile Scrum team, so the data scientist will work alongside a product owner, technical lead, and team of developers and data engineers to support delivery of high-value analytics and software products.

Position Responsibilities:
� Leads development of high complexity models and training sets
� Provides hands-on execution and implementation of data science models
� Translates business analysis needs into well-defined data science problems, and selecting appropriate models and algorithms and communicates model evaluation and implications of results back to stakeholders
� Recognizes and prioritizes the most important work related to data science models to achieve highest operational impact for analytics in the business
� Balances tradeoffs among analytics value, model development methods and design and technologies used to implement data science models with a bias toward action
� Performs collaborative work on data science problems and mentor junior data scientists
� Creates shared process models, business objects, activity diagrams and process documentation to effectively articulate multiple views of the business solutions that support technical architecture.
� Manages development of quantitative models and tools.
� Collaborates with leaders, other LOBs, and business partners to work on issues, projects or activities.
� Develops new or revises complex models to predict business demand trends, and volume and expenditures forecasts capacity analysis, and various other metrics to identify potential opportunities.
� Assesses business implications associated with modeling assumptions, inputs, methodologies, technical implementation, analytic procedures and processes, and advanced data analysis.
� Partners with leaders to drive high performance in their lines of business.
� Develop deep understanding of business drivers and financial levers to provide strategic decision support.
� Oversees resolution of complex projects and programs.
� Develops and maintains up-to-date detailed project schedules and work plans.
� Performs analysis on complex data models requiring customized reports and data and presents recommendations. Bachelor's Degree in Econometrics, Economics, Engineering, Mathematics, Applied Sciences, Statistics or job-related discipline or equivalent experience
Job-related experience, 8 years, OR Masters Degree and job-related experience, 6 years, OR Doctorate Degree and job-related experience, 3 years. Experience in data modeling, 5yrs

Desired Education / Skills:
PhD in engineering or a related field (computer science, natural sciences, mathematics)
Experience with Python, R, Scala, SQL
Experience developing solutions with Pandas/Scikit-learn, Spark or comparable technologies
Experience data science notebooks (Jupyter, Zeppelin or other)
Experience with AWS, Azure, cloud computing technologies
Scrum team experience
Energy industry experience
Experience designing efficient data science workflows and database architecture for data science purposes
Experience with forecasting, Bayesian networks, and graph analytics
Strong statistics experience
Experience with software development methodologies and software engineering principles
Knowledge of program management theories, concepts, methods, best practices, and techniques as needed to perform at the job level
Knowledge of relevant programming languages - for example Visual Basic, Ladder Logic,
Programmable Logic Controller, C, SharePoint, HTML, Java, Adobe - as needed to perform at the job level
Competency in knowing the most effective and efficient processes to get things done, with a focus on continuous improvement
Knowledge of principles, techniques, and procedures used for production and design of technology based equipment and systems as needed to perform at the job level
Knowledge of statistical theories, concepts, methods, best practices, and analyses as needed to perform at the job level
Ability to develop reports, models, and simulations as needed to perform at the job level
Competency in developing and delivering multi-mode communications that convey a clear understanding of the unique needs of different audiences
Knowledge of data model design philosophies and methodologies for data warehouse and OLTP systems


We encourage Minorities, Women, Protected Veterans and Disabled individuals to apply for all positions that they may be qualified for. We maintain a drug-free workplace and perform pre-employment substance abuse testing and background checks


If you are interested in this position, please submit your resume in a Word Document with the month and year that you have worked at each previous position to - anna@norlandgroup.com and copy: JP00000775-IT - Data Scientist to the email Subject Line.

Or click this email link and attach your resume in a MS Word Document format

Job Posted Date: 11/10/2020"
Machine Learning Engineer,Triplebyte,"About Triplebyte

Come help us build the future of software engineer hiring!

Triplebyte is on a mission to create a more just tech industry by fixing hiring for software engineers. This is important because millions of people have skills (and deserve good jobs), but don't fit the profile that recruiters seek. We aim to cut out that noise by matching opportunities to people who have the skills to succeed in them - regardless of their background. Companies from stealth-startups to global brands source and hire engineers from Triplebyte.

Over the course of 2020, we've executed well on a major pivot in our business strategy amidst a global pandemic and economic recession. Now, we're emerging from the pandemic stronger than ever. We have plenty of runway, we've been outperforming on sales / renewals, and we're excited to ramp up on our favorite activity, hiring software engineers, again.

You can read more about our company and hear from our founders in the press here:

Triplebyte raises $35M for its online coding test and credentialing service for hiring engineers
Triplebyte incubates ColorStack to increase Black and Latinx representation in CS programs
CNBC (Your Next Job Interview Could be with a Robot)
Building an Engineering Team - Harj Taggar and Ammon Bartram
Role Description

Triplebyte screens and evaluates thousands of engineers per month to find the best candidates for our partner companies. Human decision making doesn't work at our scale; our marketplace is powered by automated assessment and decision making. Triplebyte has three cornerstone ML products: our quiz, our interview, and our matchmaking. As a machine learning engineer, you'll be responsible for the end-to-end process of designing and running experiments to serving production models at scale. Some of our pipelines use off the shelf components, but we're also implementing custom models and techniques from the latest research papers. We're also building forecasting tools for internal teams to measure and predict outcomes. This is an ideal role for an engineer or data scientist who wants the scope and responsibility to own features/products from the inception and research phase through to measuring real-world results.Fields your work will touch on
Psychometrics
Recommender systems
Time series analysis
Survival analysis
Bayesian inference
Probabilistic programming
Requirements
Robust exploratory/experimental skills. We have a novel dataset of candidate profiles and interview outcomes from our candidate screening process and our hiring marketplace. You'll be responsible for designing and evaluating experiments to predict downstream outcomes.
Ability to implement models from research. Some of our best improvements in both speed and predictiveness has come from doing literature surveys and implementing novel techniques from research papers.
Engineering skills. This is a hybrid research/engineering role. You'll be responsible for productionizing your pipelines/models and integrating against our back-end services.


Compensation and Benefits

Competitive salary and stock options package

Open vacation policy

Employer paid health, vision and dental insurance

401(k) plan with matching

Pre-tax commuter benefits

Daily catered lunches

The Company is an equal opportunity employer and makes employment decisions on the basis of merit and business needs. The Company does not discriminate against employees or applicants (in any aspect of employment, including, but not limited to recruiting and hiring, job assignment, compensation, opportunities for advancement, promotion, transfers, evaluation, benefits, training, discipline, and termination), on the basis of any characteristic protected under applicable federal, state, or local laws."
Sr. Statistical Programmer,Tekruiting,"Type: contract, w2 onlyDuration: 12+ monthsUnfortunately, no visa sponsorship is provided*Summary:Statistical Programmer will be responsible for supporting statistical programming activities for registrational and non-registrational studies. Participates as part of a study team and contributes towards developing, validating, and documenting programs written using SAS or other statistical analysis software to meet the study needs. In this role, Programmer will be accountable for the implementation and delivery of complete and accurate data and reports to support regulatory submissions. Organizes and facilitates programming tasks to ensure timely study deliverables.Skills:Must have knowledge of Base SAS, SAS/STAT, SAS macros, and SAS/GRAPH.Familiarity with statistical software, statistical analyses, and databases.Statistical programming, Data ManipulationClinical Trials, medical devicesStrong verbal and written communication skills.Education:Minimum required:  Bachelor’s degree in a scientific discipline.Preferred: Master’s degree in a scientific discipline.*Job Type: ContractSchedule:Monday to FridayEducation:Master's (Preferred)Experience:Statistical programming, Data Manipulation: 1 year (Preferred)Base SAS, SAS/STAT, SAS macros, and SAS/GRAPH: 1 year (Preferred)Clinical Trials, medical devices: 1 year (Preferred)Work Remotely:No"
