Senior Consulting Data Analyst,Kaiser Permanente,"Under general supervision, this position exists to assist the organization in making strategic data-related decisions by analyzing, manipulating, tracking, internally managing, and reporting data. This position functions both as a senior analyst and as a high-level statistical analytics programmer.

Essential Functions:
Designs and enhances databases.Designs effective and user-friendly menu systems.Develops accurate, easy to read, and useful information reports.Designs and generates tracking and monitoring tools.Participates in the development of outcomes and process measures, including technical specifications to enable population measurement, guideline implementation, and evaluation.Tests complex statistical routines using macros, vendor software, and software written by self and others.Tests and maintains data integrity.May assist with sophisticated statistical models and forecasting tools using these databases.Assists with the definition of complex multi-dimensional healthcare issues and develops time tables/processes for decision making.May translate needs, issues, and ideas into effective strategies and action plans.May formulate specific implementation plans and evaluates the effectiveness of actions/programs implemented.Develops creative alternative solutions.May assist in the determination of goals and priorities with team, clients, or project management sponsors.May communicate results/recommendations to project sponsors, clients, and various senior level audiences (including physicians for TPMG departments).

Basic Qualifications:
Experience
Three (3) years of programming in SAS, SQL, VBA, net, or equivalent statistical analytical programming language.Minimum two (2) or more years of related analytical consulting experience.
Education
Bachelor's degree in economics, finance, health care administration, public health administration, statistics, mathematics, operations
research, or related field required OR four (4) years of experience in a directly related field.
High School Diploma or General Education Development (GED) required.
Licenses, Certifications, Registrations
N/A.

Additional Requirements:
Experience mainframe operating systems.Microsoft Office skills required.Strong analytic and critical thinking skills, writing skills, communication skills, consulting skills, and ability to work within a team.Ability to express complex analytical and technical information to senior management or to audiences with clinical training.Must be an independent self-starter.Must be able to work in a Labor/Management Partnership environment.

Preferred Qualifications:
Analytical consulting experience in the healthcare field preferred.Experience with MVS/TSO operating systems preferred.Experience with analytical manipulation and interpretation of large databases preferred.Project management experience preferred.Master's degree preferred.Broad familiarity with medical practices, especially population management and process and outcomes measurement preferred.Knowledge of JCL strongly preferred.
PrimaryLocation : California,San Francisco,San Francisco 4131 Geary Medical Offices 4131 Gear
HoursPerWeek : 40
Shift : Day
Workdays : Mon - Fri
WorkingHoursStart : 8:30 AM
WorkingHoursEnd : 5:00 PM
Job Schedule : Full-time
Job Type : Standard
Employee Status : Regular
Employee Group/Union Affiliation : Salaried, Non-Union, Exempt
Job Level : Individual Contributor
Job Category : Information Technology
Department : Medical Office Controllers
Travel : No
Kaiser Permanente is an equal opportunity employer committed to a diverse and inclusive workforce. Applicants will receive consideration for employment without regard to race, color, religion, sex (including pregnancy), age, sexual orientation, national origin, marital status, parental status, ancestry, disability, gender identity, veteran status, genetic information, other distinguishing characteristics of diversity and inclusion, or any other protected status.

External hires must pass a background check/drug screen. Qualified applicants with arrest and/or conviction records will be considered for employment in a manner consistent with federal and state laws, as well as applicable local ordinances, including but not limited to the San Francisco and Los Angeles Fair Chance Ordinances."
"Senior Data Scientist, eComm",Walmart,"Position Summary...
What you'll do...
Data Strategy: Understands, articulates, and applies principles of the defined strategy to routine business problems that involve a single function.
Data Source Identification: Supports the understanding of the priority order of requirements and service level agreements. Helps identify the most suitable source for data that is fit for purpose. Performs initial data quality checks on extracted data.
Analytical Modeling: Selects the analytical modeling technique most suitable for the structured, complex data and develops custom analytical models.
Conducts exploratory data analysis activities (for example, basic statistical analysis, hypothesis testing, statistical inferences) on available data.
Defines and finalizes features based on model responses and introduces new or revised features to enhance the analysis and outcomes.
Identifies the dimensions of the experiment, finalizes the design, tests hypotheses, and conducts the experiment.
Perform trend and cluster analysis on data to answer practical business problems and provide recommendations and key insights to the business.
Mentors and guides junior associates on basic modeling and analytics techniques to solve complex problems.
Model Assessment & Validation: Identifies the model evaluation metrics. Applies best practice techniques for model testing and tuning to assess accuracy, fit, validity, and robustness for multi-stage models and model ensembles.
Model Deployment & Scaling: Supports efforts to ensure that analytical models and techniques used can be deployed into production. Supports evaluation of the analytical model. Supports the scalability and sustainability of analytical models.
Code Development & Testing: Writes code to develop the required solution and application features by using the recommended programming language and leveraging business, technical, and data requirements. Test the code using the recommended testing approach.
Data Visualization: Generates appropriate graphical representations of data and model outcomes. Understands customer requirements to design appropriate data representation for multiple data sets.
Work with User Experience designers and User Interface engineers as required to build front-end applications.
Presents to and influences the team and business audience using the appropriate frameworks and conveys clear messages through business and stakeholder understanding.
Customize communication style based on stakeholder under guidance, and leverages rational arguments.
Guide and mentor junior associates on story types, structures, and techniques based on context.
Problem Formulation: Translates business problems within one's discipline to data related or mathematical solutions. Identifies what methods (for example, analytics, big data analytics, automation) would provide a solution for the problem.
Shares use cases and gives examples to demonstrate how the method would solve the business problem.
Applied Business Acumen: Provides recommendations to business stakeholders to solve complex business issues.
Develops business cases for projects with a projected return on investment or cost savings.
Translates business requirements into projects, activities, and tasks and aligns to overall business strategy.
Serves as an interpreter and conduit to connect business needs with tangible solutions and results.
Recommends new processes and ways of working.
Demonstrates up-to-date expertise and applies this to the development, execution, and improvement of action plans by providing expert advice and guidance to others in the application of information and best practices; supporting and aligning efforts to meet customer and business needs; and building commitment for perspectives and rationales.
Provides and supports the implementation of business solutions by building relationships and partnerships with key stakeholders; identifying business needs; determining and carrying out necessary processes and practices; monitoring progress and results; recognizing and capitalizing on improvement opportunities; and adapting to competing demands, organizational changes, and new responsibilities.
Models compliance with company policies and procedures and supports company mission, values, and standards of ethics and integrity by incorporating these into the development and implementation of business plans; using the Open Door Policy; and demonstrating and assisting others with how to apply these in executing business processes and practices.
Preferred Qualifications:
Solid working knowledge in statistical programming language, SQL and data visualization
Master/Phd in statistics, business analytics, data science, or Information Systems highly preferred
Minimum Qualifications...
Outlined below are the required minimum qualifications for this position. If none are listed, there are no minimum qualifications.
Option 1- Bachelor’s degree in Statistics, Economics, Analytics, Mathematics, Computer Science, Information Technology, or related field and 3
years' experience in an analytics related field. Option 2- Master’s degree in Statistics, Economics, Analytics, Mathematics, Computer Science,
Information Technology, or related field and 1 years' experience in an analytics related field. Option 3 - 5 years' experience in an analytics or
related field.
Preferred Qualifications...
Outlined below are the optional preferred qualifications for this position. If none are listed, there are no preferred qualifications.
Data science, machine learning, optimization models, Master’s degree in Machine Learning, Computer Science, Information Technology, Operations Research, Statistics, Applied Mathematics, Econometrics, Successful completion of one or more assessments in Python, Spark, Scala, or R, Using open source frameworks (for example, scikit learn, tensorflow, torch)"
Senior Software Engineer - Machine Learning,Amazon.com Services LLC,"4+ years of professional software development experience3+ years of programming experience with at least one modern language such as Java, C++, or C# including object-oriented design2+ years of experience contributing to the architecture and design (architecture, design patterns, reliability and scaling) of new and current systemsBachelor or Master's Degree in Computer Science, Applied Mathematics, or related discipline5+ years professional experience in software development with experience in working on low latency, high volume distributed systems.5+ years experience with computer science fundamentals data structures, algorithm design, problem solving, and complexity analysisExposure to Machine Learning basics (will train for more advanced skills in ML)

Amazon is investing heavily in building a world class advertising business and we are responsible for defining and delivering a collection of self-service performance advertising products that drive discovery and sales. Our products are strategically important to our Retail and Marketplace businesses driving long term growth. We deliver billions of ad impressions and millions of clicks daily and are breaking fresh ground to create world-class products. We are highly motivated, collaborative and fun-loving with an entrepreneurial spirit and bias for action. With a broad mandate to experiment and innovate, we are growing at an unprecedented rate with a seemingly endless range of new opportunities.

Our systems and algorithms operate on one of the world's largest product catalogs, matching shoppers with advertised products with a high relevance bar and strict latency constraints. We work hand-in-hand with Machine Learning scientists to come up with novel solutions that deliver highly relevant ads. We consistently strive to improve the customer search and detail page experiences. You will drive appropriate technology choices for the business, lead the way for continuous innovation, and shape the future of e-commerce. This is an opportunity to make a significant impact on the future of the Amazon vision.

As a Senior Software Development Engineer in Machine Learning at Amazon, you will drive the technical direction of our offerings and solutions, working with many different technologies across the sponsored products organization. You will design, code, troubleshoot, and support scalable machine-learning pipelines and online serving systems. You will work closely with applied scientists to optimize the performance of machine-learning models and infrastructure, and implement end-to-end solutions. What you create is also what you own. In addition to being a strongly motivated individual contributor, you will also be responsible for mentoring junior engineers and guiding them to deliver to the full potential.

The team is open to hiring this engineering into the Palo Alto office or with a flexibile schedule of coming into the office or as a full remote/virutal employee.

Experience in building large-scale machine-learning infrastructure for online recommendation, ads ranking, personalization, or search, etc.Experience with Big Data technologies such as AWS, Hadoop, Spark, Pig, Hive, etc.Strong proficiency with Java, Python, Scala or C++Advanced knowledge of performance, scalability, enterprise system architecture, and engineering best practicesStrong written and verbal communication
Amazon is an Equal Opportunity-Affirmative Action Employer – Minority / Female / Disability / Veteran / Gender Identity / Sexual Orientation/Age
#SQLBDSDE3
#SQLBDSDE3ADS
#VIRBDSDE3
#VIRBDSDE3ADS
#PASDE3"
Computer Vision/Machine Learning Intern,Sony Interactive Entertainment PlayStation,"PlayStation isn't just the Best Place to Play —it's also the Best Place to Work. We've thrilled gamers since 1994, when we launched the original PlayStation. Today, we're recognized as a global leader in interactive and digital entertainment. The PlayStation brand falls under Sony Interactive Entertainment, a wholly-owned subsidiary of Sony Corporation.

This internship is for Summer 2021.

Computer Vision/Machine Learning Intern

San Mateo, CA

Responsibilities:
As the computer vision/machine learning intern, you will use computer vision and ML techniques to help build in-game content.
You will be exposed to general human face/body tracking technology development such as facial part tracking, gaze tacking, emotion estimation, body part tracking
You will do creative research on FACS model animation / emotion expression / segmentation / feature detection / object localization
Generate animated face / body rig based on tracking result for in game content or real time character movement in game.
Application development based on tracking result
Qualifications:
Pursuing a Bachelor's, Master's degree, or PhD in Computer Science (or related field), and/or within 1 year of their post-graduation date
Strong work ethic with outstanding verbal and written communication skills and be able to work with others at all levels
Experience programming in Python and C++
Working experience of PyTorch or Tensorflow 2.0 experience
Computer Vision experience
Familiar with OpenCV
Knowledge of Image sensor / ISP / Camera calibration
Game engine experience such as UE4

Sony is an Equal Opportunity Employer. All persons will receive consideration for employment without regard to race, color, religion, gender, pregnancy, national origin, ancestry, citizenship, age, legally protected physical or mental disability, covered veteran status, status in the U.S. uniformed services, sexual orientation, marital status, genetic information or membership in any other legally protected category.

We strive to create an inclusive environment, empower employees and embrace diversity. We encourage everyone to respond.

We sincerely appreciate the time and effort you spent in contacting us and we thank you for your interest in PlayStation."
"Engineering Manager, Machine Learning",Discord,"Discord's Machine Learning team is a mix of systems engineers, machine learning engineers and data scientists. Our mission is to use state-of-the-art machine learning techniques to build ML applications across Discord's product surfaces and infrastructure. Since we're still a small team, we also build and operate the tools we use as well as the infrastructure to label data, create features, train, evaluate and serve both online and offline models. We work on a range of problems that involve classification, scoring, ranking, textual understanding, and spam detection. &nbsp; Discord is looking for a highly technical, hands-on, and mission-driven Engineering Manager to lead our Machine Learning team to help us scale to the next level. As a manager reporting to the Director of Data Platform, you will have significant leadership and outsize influence on the evolution of Discord's machine learning systems and applications. &nbsp; If that sounds exciting to you, read on! What you'll be doing Build and operate the tools we use as well as the infrastructure to label data, create features, train, evaluate and serve both online and offline models. Build and lead a team of highly-engaged engineers by hiring, coaching, and instilling a sense of ownership and impact. Build the vision and roadmap for the Machine Learning team by working with your team and partners across the company. Manage processes and use your technical expertise to continually ensure that your team achieves extraordinary results. Work with other Engineering Managers to continuously improve the Engineering organization and uphold our workplace philosophy. What you should have You have 5+ years of experience as a Software Engineer. You have 3+ years of experience as an Engineering Manager and successfully managed a team of 5+ Software Engineers. You're a mentor, storyteller, and you're great at coordinating with a variety of teams throughout the company. You excel in undefined environments and get excited about finding solutions to complex technical challenges, and then building them. You enjoy coming up with pragmatic solutions to concrete problems using first principles thinking. You've worked with complex distributed machine learning systems deployed at scale. You keep up with the industry trends and continuously identify new tools to use to solve technical problems. Bonus Points Experience with ML libraries/frameworks like TensorFlow, PyTorch, Keras or XGBoost Experience with modern cloud platforms like Google Cloud Platform or Amazon Web Services Experience working with modern data technologies (Spark, Hive, Kafka, Beam, or Airflow) Experience hiring for fast-growing startups Benefits and Perks Medical insurance including Health, Dental, Vision&nbsp; 13 paid holidays&nbsp; Unlimited sick days&nbsp; Parental Leave and fertility benefits&nbsp; Supported-employee clubs and Employee Resource Groups&nbsp; Commuter Contributions of $270 a month (pretax)&nbsp; Daily lunches and unlimited snacks&nbsp; Monthly gym and fitness stipend&nbsp; About Us Friends, coworkers, gamers, nerds, moms, dads, engineers, designers, marketers, support. Originally, we created Discord to help people come together around games. It's been amazing to watch it grow into what it is today - a place where millions of diverse communities exist and people connect with old friends and new. Diversity and inclusiveness are a critical part of how we get to what's next. We believe that with diversity comes a better product, better decisions, and a better work environment. As we continue to grow, our values keep us dedicated to building a company that is representative of the world we live and play in. Discord is an equal opportunity employer committed to promoting an inclusive work environment free of discrimination and harassment. We value diversity, inclusion, and aim to provide a sense of belonging for everyone."
